εἰ εἰ δʼ δʼ αὐ2 αὐ ὁ οἱ δαιμων δαιμονες θεαω θεων παιδες παιδες εἰμι εἰσιν νοθος νοθοι τινες τινες ἠ ἠ ἐκ ἐκ νυμφη νυμφων ἠ ἠ ἐκ ἐκ τις τινων ἀλλος ἀλλων ὁς ὡν δη δη και και λεγω1 λεγονται τις τις ἀν ἀν ἀνθρωπος ἀνθρωπων θεαω θεων μεν μεν παις παιδας ἡγεομαι ἡγοιτο εἰμι εἰναι θεους θεους δε δε μη μη	plato
ἀλλʼ ἀλλʼ ἀπορια ἀποριᾳ μεν μεν ἁλισκομαι ἑαλωκα οὐ οὐ μεντοι μεντοι λογαω λογων ἀλλα ἀλλα τολμαω τολμης και και ἀναισχυντια ἀναισχυντιας και και ὁ του μη μη ἐθελω ἐθελειν λεγω1 λεγειν προς προς συ ὑμας τοιουτος τοιαυτα οἱʼ οἱʼ ἀν ἀν συ ὑμιν μεν μεν ἡδυς ἡδιστα εἰμι ἠν ἀκουω ἀκουειν θρηνουντος θρηνουντος συ τε ἐγω μου και και ὀδυρομαι ὀδυρομενου και και ἀλλος ἀλλα ποιεω ποιουντος και και λεγω1 λεγοντος πολλα πολλα και και ἀναξιος ἀναξια ἐμεω ἐμου ὡς ὡς ἐγω ἐγω φημι φημι οἱος οἱα δη δη και και ἐθιζω εἰθισθε συ ὑμεις ὁ των ἀλλος ἀλλων ἀκουω ἀκουειν	plato
ἐμοι ἐμοι γαρ γαρ εἰμι ὠ ἀνηρ ἀνδρες δικασταιὑμας δικασταιὑμας γαρ γαρ δικαστας δικαστας καλεω καλων ὀρθοω ὀρθως ἀν ἀν καλοιηνθαυμασιον καλοιηνθαυμασιον τις τι γιγνομαι γεγονεν	plato
οὑτος ταυτα και και νεος νεωτερῳ και και πρεσβυς πρεσβυτερῳ ὁστις ὁτῳ ἀν ἀν ἐντυγχανω ἐντυγχανω ποιεω ποιησω και και ξενος ξενῳ και και ἀστος ἀστῳ μαλλον μαλλον δε δε ὁ τοις ἀστος ἀστοις ὁσος ὁσῳ ἐγω μου ἐγγυτερος ἐγγυτερω ἐστε ἐστε γενος γενει	plato
ἀντι ἀντι οὑτος τουτου δη δη αἱρεω ἑλωμαι ὁς ὡν εὐ εὐ οἰδα οἰδα τις τι κακοω κακων εἰμι ὀντων οὑτος τουτου τιμαω τιμησαμενος	plato
ἑρμογενης Ἑρμογενης μεντοι μεντοι ὁ ὁ ἱππονικος Ἱππονικου ἑταιρος ἑταιρος τε τε εἰμι ἠν αὐτος αὐτῳ και και ἐξαγγελλω ἐξηγγειλε περι περι αὐτος αὐτου τοιουτος τοιαυτα ὡστε ὡστε πρεπω πρεπουσαν φαινω φαινεσθαι την την μεγαληγορια μεγαληγοριαν αὐτος αὐτου ὁ τῃ διανοια διανοιᾳ	xenophon
ἐγω ἐγω γαρ γαρ εἰμι ὠ ἀνηρ ἀνδρες ἀθηναιος Ἀθηναιοι ἀλλος ἀλλην μεν μεν ἀρχην ἀρχην οὐδεις οὐδεμιαν πωποτε πωποτε ἀρχω ἠρξα ἐν ἐν ὁ τῃ πολεω πολει βουλευω ἐβουλευσα δε δε	plato
τις τι δη δη λεγω1 λεγοντες διαβαλλω διεβαλλον ὁ οἱ διαβαλλω διαβαλλοντες	plato
νυν νυν δε δε οὐ οὐ γαρ γαρ εἰμι ἐστιν εἰ εἰ μη μη ἀρον ἀρα ὁσος ὁσον ἀν ἀν ἐγω ἐγω δυναμαι δυναιμην ἐκτινω ἐκτεισαι τοσουτος τοσουτου βουλεσθε βουλεσθε ἐγω μοι τιμαω τιμησαι	plato
ἀλλʼ ἀλλʼ εἰμι ὠ σωκρατης Σωκρατες το το σον σον τις τι εἰμι ἐστι πραγμα πραγμα	plato
μα μα Διʼ Διʼ εἰπον εἰπειν αὐτος αὐτον εἰμι ὠ ἑρμογενης Ἑρμογενες ἐγω ἐγω οὑτος ταυτα οὐδε οὐδε προθυμεομαι προθυμησομαι ἀλλʼ ἀλλʼ ὁσος ὁσων νομιζω νομιζω τυγχανω τετυχηκεναι καλεω καλων και και παρα παρα θεαω θεων και και παρʼ παρʼ ἀνθρωπος ἀνθρωπων και και ἡν ἡν ἐγω ἐγω δοκεω δοξαν ἐχω ἐχω περι περι ἐμαυτου ἐμαυτου οὑτος ταυτην ἀναφαινω ἀναφαινων εἰ εἰ βαρυνω βαρυνω τους τους δικαστης δικαστας αἱρεω αἱρησομαι τελευταω τελευταν μαλλον μαλλον ἠ ἠ ἀνελευθερος ἀνελευθερως το το ζαω ζην ἐτι ἐτι προσαιτεω προσαιτων κερδαινω κερδαναι τον τον πολυ πολυ χειροω χειρω βιοω βιον ἀντι ἀντι θανατοω θανατου	xenophon
εἰ εἰ δε δε τις τις φημι φησι παρʼ παρʼ ἐμεω ἐμου πωποτε πωποτε τις τι μανθανω μαθειν ἠ ἠ ἀκουω ἀκουσαι ἰδιος ἰδιᾳ ὁστις ὁτι μη μη και και ὁ οἱ ἀλλος ἀλλοι πας παντες εὐ εὐ οἰδα ἰστε ὁστις ὁτι οὐ οὐκ ἀληθης ἀληθη λεγω1 λεγει	plato
και και ἀλλος ἀλλαι μηχαναι μηχαναι πολυς πολλαι εἰμι εἰσιν ἐν ἐν ἑκαστος ἑκαστοις ὁ τοις κινδυνος κινδυνοις ὡστε ὡστε διαφευγω διαφευγειν θανατος θανατον ἐαν ἐαν τις τις τολμαω τολμᾳ πας παν ποιεω ποιειν και και λεγω1 λεγειν	plato
ἐγω ἐγω μεν μεν δη δη κατανοεω κατανοων ὁ του ἀνδρος ἀνδρος ὁ την τε τε σοφια σοφιαν και και την την γενναιοτης γενναιοτητα οὐτε οὐτε μη μη μιμνησκω μεμνησθαι δυναμαι δυναμαι αὐτος αὐτου οὐτε οὐτε μιμνησκω μεμνημενος μη μη οὐ οὐκ ἐπαινεω ἐπαινειν	xenophon
οὑτος ταυτα γαρ γαρ εἰμι ὠ ἀνηρ ἀνδρες ἀθηναιος Ἀθηναιοι οὐτε οὐτε συ ὑμας χρη χρη ποιεω ποιειν τους τους δοκεω δοκουντας και και ὁπη ὁπῃουν τις τι εἰμι εἰναι οὐτʼ οὐτʼ ἀν ἀν ἐγω ἡμεις ποιεω ποιωμεν συ ὑμας ἐπιτρεπω ἐπιτρεπειν ἀλλα ἀλλα οὑτος τουτο αὐτο αὐτο ἐνδεικνυμι ἐνδεικνυσθαι ὁστις ὁτι πολυ πολυ μαλλον μαλλον καταψηφιζομαι καταψηφιεισθε ὁ του τα τα ἐλεινα ἐλεινα οὑτος ταυτα δραμα δραματα εἰσαγω εἰσαγοντος και και καταγελαστος καταγελαστον την την πολις πολιν ποιεω ποιουντος ἠ ἠ ὁ του ἡσυχια ἡσυχιαν ἀγω ἀγοντος	plato
πλατων Πλατων δε δε ὁδε ὁδε εἰμι ὠ ἀνηρ ἀνδρες ἀθηναιος Ἀθηναιοι και και κριτων Κριτων και και κριτοβουλος Κριτοβουλος και και ἀπολλοδωρος Ἀπολλοδωρος κελευουσι κελευουσι ἐγω με τριακοντα τριακοντα μνα μνων τιμαω τιμησασθαι αὐτοι αὐτοι δʼ δʼ ἐγγυαω ἐγγυασθαι	plato
νυν νυν ἐγω ἐγω προτερος πρωτον ἐπι ἐπι δικαστηριον δικαστηριον ἀναβαινω ἀναβεβηκα ἐτος ἐτη γεγονως γεγονως ἑβδομηκοντα ἑβδομηκοντα	plato
ἐαν ἐαν δε δε ἁλισκομαι ἁλῳς ἐτι ἐτι οὑτος τουτο πρασσω πραττων ἀποθνησκω ἀποθανῃ εἰ εἰ οὐν οὐν ἐγω με ὁσπερ ὁπερ εἰπον εἰπον ἐπι ἐπι οὑτος τουτοις ἀφιημι ἀφιοιτε εἰποιμʼ εἰποιμʼ ἀν ἀν συ ὑμιν ὁστις ὁτι ἐγω ἐγω συ ὑμας εἰμι ὠ ἀνηρ ἀνδρες ἀθηναιος Ἀθηναιοι ἀσπαζομαι ἀσπαζομαι μεν μεν και και φιλεω φιλω πειθω πεισομαι δε δε μαλλον μαλλον ὁ τῳ θεαω θεῳ ἠ ἠ συ ὑμιν και και ἑωσπερ ἑωσπερ ἀν ἀν ἐμπνεω ἐμπνεω και και οἱος οἱος τε τε εἰμι ὠ οὐ οὐ μη μη παυω παυσωμαι φιλοσοφεω φιλοσοφων και και συ ὑμιν παρακελευομενος παρακελευομενος τε τε και και ἐνδεικνυμι ἐνδεικνυμενος ὁστις ὁτῳ ἀν ἀν ἀει ἀει ἐντυγχανω ἐντυγχανω συ ὑμων λεγω1 λεγων οἱαπερ οἱαπερ ἐθω εἰωθα ὁστις ὁτι εἰμι ὠ ἀριστος ἀριστε ἀνδροω ἀνδρων ἀθηναιος Ἀθηναιος εἰμι ὠν πολις πολεως ὁ της μεγας μεγιστης και και εὐδοκιμος εὐδοκιμωτατης εἰς εἰς σοφια σοφιαν και και ἰσχυς ἰσχυν χρημα χρηματων μεν μεν οὐ οὐκ αἰσχυνω αἰσχυνῃ ἐπιμελεομαι ἐπιμελουμενος ὁπως ὁπως συ σοι εἰμι ἐσται ὡς ὡς πλειστος πλειστα και και δοξα δοξης και και τιμαω τιμης φρονησις φρονησεως δε δε και και ἀληθεια ἀληθειας και και ὁ της ψυχη ψυχης ὁπως ὁπως ὡς ὡς βελτιστος βελτιστη εἰμι ἐσται οὐ οὐκ ἐπιμελεομαι ἐπιμελῃ οὐδε οὐδε φροντιζω φροντιζεις	plato
και και γαρ γαρ ἐν ἐν ὁ ταις μαχη μαχαις πολλακις πολλακις δηλος δηλον γιγνομαι γιγνεται ὁστις ὁτι ὁ το γε γε ἀποθνησκω ἀποθανειν ἀνα ἀν τις τις ἐκφευγω ἐκφυγοι και και ὁπλον ὁπλα ἀφεις ἀφεις και και ἐφʼ ἐφʼ ἱκετεια ἱκετειαν τρεπω τραπομενος ὁ των διωκω διωκοντων	plato
καιτοι καιτοι ἐφιστημι ἐπισταμεθα μεν μεν δηπου δηπου τινω τινες εἰσι εἰσι νεω νεων διαφθορα διαφθοραι	xenophon
ἐγω ἐγω οὐν οὐν δεινα δεινα ἀν ἀν εἰμι εἰην ἐργαζομαι εἰργασμενος εἰμι ὠ ἀνηρ ἀνδρες ἀθηναιος Ἀθηναιοι εἰ εἰ ὁστε ὁτε μεν μεν ἐγω με ὁ οἱ ἀρχω ἀρχοντες τασσω ἐταττον οὑς οὑς συ ὑμεις αἱρεω εἱλεσθε ἀρχω ἀρχειν ἐγω μου και και ἐν ἐν ποτειδαια Ποτειδαιᾳ και και ἐν ἐν ἀμφιπολεω Ἀμφιπολει και και ἐπι ἐπι δηλιος Δηλιῳ τοτε τοτε μεν μεν ἱημι οὑ ἐκεινος ἐκεινοι τασσω ἐταττον μενω ἐμενον ὡσπερ ὡσπερ και και ἀλλος ἀλλος τις τις και και κινδυνευω ἐκινδυνευον ἀποθνησκω ἀποθανειν ὁ του δε δε θεαομαι θεου τασσω ταττοντος ὡς ὡς ἐγω ἐγω οἰομαι ᾠηθην τε τε και και ὑπολαμβανω ὑπελαβον φιλοσοφουντα φιλοσοφουντα ἐγω με δεω1 δειν ζαω ζην και και ἐξεταζω ἐξεταζοντα ἐμαυτον ἐμαυτον και και τους τους ἀλλος ἀλλους ἐνταυθα ἐνταυθα δε δε φοβηθεις φοβηθεις ἠ ἠ θανατος θανατον ἡ ἡ ἀλλʼ ἀλλʼ ὁτιουν ὁτιουν πραγμα πραγμα λειπω λιποιμι την την ταξις ταξιν	plato
οὑτος τουτων γαρ γαρ ἑκαστος ἑκαστος εἰμι ὠ ἀνηρ ἀνδρες οἱος οἱος τʼ τʼ ἐστιν ἐστιν ἰων ἰων εἰς εἰς ἑκαστος ἑκαστην ὁ των πολυς πολεων τους τους νεουςοἱς νεουςοἱς ἐξεστι ἐξεστι ὁ των ἑαυτου ἑαυτων πολιτης πολιτων προιξ προικα συνιημι συνειναι ὁς ᾡ ἀν ἀν βουλωνταιτουτους βουλωνταιτουτους πειθω πειθουσι τας τας κενοω ἐκεινων συνουσια συνουσιας ἀπολειπω ἀπολιποντας σφεις σφισιν συνιημι συνειναι χρημα χρηματα διδωμι διδοντας και και χαρις χαριν προσοιδα προσειδεναι	plato
λεγω1 λεγω δε δε και και ὁδε τοδε προς προς τους τους αὐτους αὐτους οὑτος τουτους	plato
εἰ εἰ δʼ δʼ αὐ2 αὐ οἱος οἱον ἀποδημησαι ἀποδημησαι εἰμι ἐστιν ὁ ὁ θανατος θανατος ἐνθενδε ἐνθενδε εἰς εἰς ἀλλος ἀλλον τοπος τοπον και και ἀληθης ἀληθη εἰμι ἐστιν τα τα λεγω1 λεγομενα ὡς ὡς ἀρον ἀρα ἐκει ἐκει εἰμι εἰσι πας παντες ὁ οἱ θνησκω τεθνεωτες τις τι μεγας μειζον ἀγαθον ἀγαθον οὑτος τουτου εἰμι εἰη ἀνα ἀν εἰμι ὠ ἀνηρ ἀνδρες δικαστης δικασται	plato
εἰτʼ εἰτʼ οὐ οὐκ αἰσχυνω αἰσχυνῃ εἰμι ὠ σωκρατης Σωκρατες τοιουτος τοιουτον ἐπιτηδευμα ἐπιτηδευμα ἐπιτηδευω ἐπιτηδευσας ἐκ ἐξ ἱημι οὑ κινδυνευω κινδυνευεις νυνι νυνι ἀποθνησκω ἀποθανειν	plato
ἀλλʼ ἀλλʼ ἐγω ἐγω εἰμι ὠ ἀνηρ ἀνδρες οὑτος τουτο μεν μεν προτερος πρωτον θαυμαζω θαυμαζω μελητος Μελητου ὁστις ὁτῳ ποτε ποτε γνους γνους λεγω1 λεγει ὡς ὡς ἐγω ἐγω οὑς οὑς ὁ ἡ πολις πολις νομιζω νομιζει θεους θεους οὐ οὐ νομιζω νομιζω	xenophon
τουτι τουτι δη δη εἰμι ἐστι πας παντων χαλεπος χαλεπωτατον πεισαι πεισαι τις τινας συ ὑμων	plato
το το δε δε κινδυνευω κινδυνευει εἰμι ὠ ἀνηρ ἀνδρες ὁ τῳ εἰμι ὀντι ὁ ὁ θεος θεος σοφος σοφος εἰμι εἰναι και και ἐν ἐν ὁ τῳ χρησμος χρησμῳ οὑτος τουτῳ οὑτος τουτο λεγω1 λεγειν ὁστις ὁτι ὁ ἡ ἀνθρωπινος ἀνθρωπινη σοφια σοφια ὀλιγος ὀλιγου τινος τινος ἀξιος ἀξια ἐστιν ἐστιν και και οὐδεις οὐδενος	plato
οἰδα οἰδε μεν μεν γαρ γαρ οὐδεις οὐδεις τον τον θανατος θανατον οὐδʼ οὐδʼ εἰ εἰ τυγχανω τυγχανει ὁ τῳ ἀνθρωπος ἀνθρωπῳ πας παντων μεγας μεγιστον ὀν ὀν ὁ των ἀγαθος ἀγαθων δειδω δεδιασι δʼ δʼ ὡς ὡς εὐ εὐ οἰδα εἰδοτες ὁστις ὁτι μεγας μεγιστον ὁ των κακοω κακων εἰμι ἐστι	plato
οὐ οὐ γαρ γαρ δη δη και και στρατηγους στρατηγους αἱρεω αἱρεισθε και και προ προ πατηρ πατερων και και προ προ ἀδελφος ἀδελφων και και ναι ναι μα μα διος Δια γε γε συ ὑμεις προ προ συ ὑμων αὐτος αὐτων οὑς οὑς ἀν ἀν ἡγεομαι ἡγησθε περι περι ὁ των πολεμικος πολεμικων φρονιμος φρονιμωτατους εἰμι εἰναι	xenophon
ἐγω ἐγω δʼ δʼ οὐν οὐν και και αὐτος αὐτος ὑπʼ ὑπʼ αὐτος αὐτων ὀλιγος ὀλιγου ἐμαυτου ἐμαυτου ἐπιλανθανομαι ἐπελαθομην οὑτως οὑτω πιθανος πιθανως λεγω1 ἐλεγον	plato
ἀκουω ἀκηκοατε εἰμι ὠ ἀνηρ ἀνδρες ἀθηναιος Ἀθηναιοι πας πασαν συ ὑμιν την την ἀληθεια ἀληθειαν ἐγω ἐγω εἰπον εἰπον	plato
ἀγω ἀγε δη δη ἀκουω ἀκουσατε και και ἀλλος ἀλλα ἱνα ἱνα ἐτι ἐτι μαλλον μαλλον ὁ οἱ βουλομαι βουλομενοι συ ὑμων ἀφιστημι ἀπιστωσι ὁ τῳ ἐμε ἐμε τιμαω τετιμησθαι ὑπο ὑπο δαιμοναω δαιμονων	xenophon
ὡστε ὡστε θαυμαστον θαυμαστον ἐγω ἐμοιγε δοκεω δοκει εἰμι εἰναι ὁπως ὁπως ποτε ποτε φαινω ἐφανη συ ὑμιν ὁ του θανατοω θανατου ἐργνυμι ἐργον ἀξιος ἀξιον ἐμοι ἐμοι ἐργαζομαι εἰργασμενον	xenophon
σωκρατης Σωκρατους δε δε ἀξιον ἀξιον ἐγω μοι δοκεω δοκει εἰμι εἰναι μιμνησκω μεμνησθαι και και ὡς ὡς ἐπειδη ἐπειδη καλεω ἐκληθη εἰς εἰς την την δικη δικην βουλευω ἐβουλευσατο περι περι τε τε ὁ της ἀπολογια ἀπολογιας και και ὁ της τελευταω τελευτης ὁ του βιοω βιου	xenophon
ὁστις ὁτι δε δε οὑτως οὑτως γιγνωσκω ἐγιγνωσκε καταδηλος καταδηλοτερον γιγνομαι ἐγενετο ἐπειδη ἐπειδη και και ὁ ἡ δικη δικη καταψηφιζομαι κατεψηφισθη	xenophon
ἐγω ἐγω δε δε διδασκαλος διδασκαλος μεν μεν οὐδενος οὐδενος πωποτʼ πωποτʼ γιγνομαι ἐγενομην	plato
ἐπειτα ἐπειτα εἰμι εἰσιν οὑτος οὑτοι ὁ οἱ κατηγορος κατηγοροι πολλοι πολλοι και και πολυν πολυν χρονος χρονον ἠδος ἠδη κατηγορεω κατηγορηκοτες ἐτι ἐτι δε δε και και ἐν ἐν οὑτος ταυτῃ ὁ τῃ ἡλικια ἡλικιᾳ λεγω1 λεγοντες προς προς συ ὑμας ἐν ἐν ἱημι ᾑ ἀν ἀν μαλιστα μαλιστα πιστευω ἐπιστευσατε παις παιδες εἰμι ὀντες ἐνιοι ἐνιοι συ ὑμων και και μειρακιον μειρακια ἀτεχνος ἀτεχνως ἐραομαι ἐρημην κατηγορεω κατηγορουντες ἀπολογεομαι ἀπολογουμενου οὐδεις οὐδενος	plato
μετα μετα ταυτʼ ταυτʼ οὐν οὐν ἠδος ἠδη ἐπωχατο ἐφεξης εἰμι ᾐα αἰσθανομαι αἰσθανομενος μεν μεν και και λυπεω λυπουμενος και και δεδιως δεδιως ὁστις ὁτι ἀπεχθανομαι ἀπηχθανομην ὁμοω ὁμως δε δε ἀναγκαιος ἀναγκαιον δοκεω ἐδοκει εἰμι εἰναι το το ὁ του θεαομαι θεου περι περι πλειστος πλειστου ποιεισθαιἰτεον ποιεισθαιἰτεον οὐν οὐν σκοπαω σκοπουντι τον τον χρησμον χρησμον τις τι λεγω1 λεγει ἐπι ἐπι ἁπας ἁπαντας ὁ τους τις τι δοκεω δοκουντας οἰδα εἰδεναι	plato
ἀκουω ἀκουσατε δη δη ἐγω μοι τα τα συμβαινω συμβεβηκοτα ἱνα ἱνα οἰδα εἰδητε ὁστις ὁτι οὐδʼ οὐδʼ ἀν ἀν ἑνι ἑνι ὑπεικω ὑπεικαθοιμι παρα παρα το το δικαιος δικαιον δειδω δεισας θανατος θανατον μη μη ὑπεικω ὑπεικων δε δε ἀλλα ἀλλα κἀν κἀν ἀπολλυμι ἀπολοιμην	plato
ὀρθοω ὀρθως δε δε ὁ οἱ θεοι θεοι τοτε τοτε ἐγω μου ἐναντιοομαι ἠναντιουντο φαινω φαναι αὐτος αὐτον ὁ τῃ ὁ του λογοω λογου ἐπισκεπτομαι ἐπισκεψει ὁστε ὁτε δοκεω ἐδοκει ἐγω ἡμιν ζητητης ζητητεα εἰμι εἰναι ἐκ ἐκ παντος παντος τροποω τροπου τα τα ἀποφευκτικος ἀποφευκτικα	xenophon
ἐαν ἐαν δε δε μη μη ἀπελαυνω ἀπελαυνω ὁ οἱ οὑτος τουτων πατηρ πατερες δε δε και και οἰκειος οἰκειοι διʼ διʼ αὐτους αὐτους οὑτος τουτους	plato
εἰμι ὠ παις παι εἰ εἰ τιμωρεω τιμωρησεις πατροκλος Πατροκλῳ ὁ τῳ ἑταιρος ἑταιρῳ τον τον φονος φονον και και ἑκτωρ Ἑκτορα ἀποκτεινω ἀποκτενεις αὐτος αὐτος ἀποθανῃαὐτικα ἀποθανῃαὐτικα γαρ γαρ συ τοι φημι φησι μεθʼ μεθʼ ἑκτωρ Ἑκτορα ποτμος ποτμος ἑτοιμος ἑτοιμος ὁ ὁ δε δε οὑτος τουτο ἀκουω ἀκουσας ὁ του μεν μεν θανατοω θανατου και και ὁ του κινδυνος κινδυνου ὀλιγωρεω ὠλιγωρησε πολυ πολυ δε δε μαλλον μαλλον δειδω δεισας το το ζαω ζην κακος κακος ὠν ὠν και και ὁ τοις φιλος φιλοις μη μη τιμωρεω τιμωρειν αὐτικα αὐτικα φημι φησι θνησκω τεθναιην δικη δικην ἐπιθεις ἐπιθεις ὁ τῳ ἀδικεω ἀδικουντι ἱνα ἱνα μη μη ἐνθαδε ἐνθαδε μενω μενω καταγελαστος καταγελαστος παρα παρα νηυσι νηυσι κορωνις κορωνισιν ἀχθος ἀχθος ἀρουρα ἀρουρης	plato
ἰσοω ἰσως γαρ γαρ ἀνα ἀν ἐγω μοι οὑτος τουτου τιμαω τιμησαιτε	plato
οὐ οὐχ ὁραω ὁρᾳς τα τα ἀθηναιος Ἀθηναιων δικαστηριον δικαστηρια ὡς ὡς πολλακις πολλακις μεν μεν οὐδεν οὐδεν ἀδικεω ἀδικουντας λογος λογῳ παραγω παραχθεντες ἀποκτεινω ἀπεκτειναν πολλακις πολλακις δε δε ἀδικεω ἀδικουντας ἠ ἠ ἐκ ἐκ ὁ του λογοω λογου οἰκτιζω οἰκτισαντες ἠ ἠ ἐπιχαρις ἐπιχαριτως εἰπον εἰποντας ἀπολυω ἀπελυσαν	xenophon
τον τον δε δε λεγω1 λεγεται καταψαω καταψησαντα αὐτος αὐτου την την κεφαλην κεφαλην εἰπον εἰπειν	xenophon
τον τον μεν μεν γαρ γαρ διαφθειρω διαφθειροντα ἐξευρισκω ἐξευρων ὡς ὡς φημι φῃς ἐγω ἐμε εἰσαγω εἰσαγεις τουτοισι τουτοισι και και κατηγορεω κατηγορεις	plato
