ἐπειτα κἀπειτα πειραω ἐπειρωμην αὐτος αὐτῳ δεικνυμι δεικνυναι ὁστις ὁτι οἰομαι οἰοιτο μεν μεν εἰμι εἰναι σοφος σοφος εἰμι εἰη δʼ δʼ οὐ οὐ	plato
μελλω μελλω γαρ γαρ συ ὑμας διδασκω διδαξειν ὁθεν ὁθεν ἐγω μοι ὁ ἡ διαβολη διαβολη γιγνομαι γεγονεν	plato
και και οὑτος τουτων ἐγω ἐγω εἰτε εἰτε τις τις χρηστος χρηστος γιγνομαι γιγνεται εἰτε εἰτε μη μη οὐ οὐκ ἀν ἀν δικαιοω δικαιως την την αἰτιος αἰτιαν ὑπεχω ὑπεχοιμι ὁς ὡν μητε μητε ὑπεχω ὑπεσχομην μηδενι μηδενι μηδεν μηδεν πωποτε πωποτε μαθημα μαθημα μητε μητε διδασκω ἐδιδαξα	plato
ἀλλα ἀλλα μεντοι μεντοι και και το το προοιδα προειδεναι γε γε τον τον θεον θεον το το μελλω μελλον και και το το προσημαινω προσημαινειν ὁς ᾡ βουλομαι βουλεται και και οὑτος τουτο ὡσπερ ὡσπερ ἐγω ἐγω φημι φημι οὑτως οὑτω πας παντες και και λεγω1 λεγουσι και και νομιζω νομιζουσιν	xenophon
ἐρω ἐρω δε δε συ ὑμιν φορτικα φορτικα μεν μεν και και δικανικος δικανικα ἀληθης ἀληθη δε δε	plato
οὐδε οὐδε ἡλιος ἡλιον οὐδε οὐδε σεληνη σεληνην ἀρον ἀρα νομιζω νομιζω θεους θεους εἰμι εἰναι ὡσπερ ὡσπερ ὁ οἱ ἀλλος ἀλλοι ἀνθρωπος ἀνθρωποι	plato
και και ἐπειδαν ἐπειδαν ἐγω μοι μη μη δοκεω δοκῃ ὁ τῳ θεαω θεῳ βοηθεω βοηθων ἐνδεικνυμι ἐνδεικνυμαι ὁστις ὁτι οὐ οὐκ εἰμι ἐστι σοφος σοφος	plato
ἐγω ἐγω δε δε δη δη τις τινος συ ὑμιν ἀντιτιμαω ἀντιτιμησομαι εἰμι ὠ ἀνηρ ἀνδρες ἀθηναιος Ἀθηναιοι	plato
και και γαρ γαρ οὑτος οὑτοι λεγω1 λεγουσι μεν μεν πολλα πολλα και και καλος καλα οἰδα ἰσασιν δε δε οὐδεν οὐδεν ὁς ὡν λεγω1 λεγουσι	plato
συ ὑμεις δʼ δʼ ἰσοω ἰσως ταχʼ ταχʼ ἀν ἀν ἀχθομαι ἀχθομενοι ὡσπερ ὡσπερ ὁ οἱ νυσταζω νυσταζοντες ἐγειρω ἐγειρομενοι κρουω κρουσαντες ἀνα ἀν ἐγω με πειθω πειθομενοι ἀνυτος Ἀνυτῳ ῥαιδιος ῥᾳδιως ἀν ἀν ἀποκτεινω ἀποκτειναιτε εἰτα εἰτα τον τον λοιπον λοιπον βιοω βιον καθευδω καθευδοντες διατελεω διατελοιτε ἀνα ἀν εἰ εἰ μη μη τις τινα ἀλλος ἀλλον ὁ ὁ θεος θεος συ ὑμιν ἐπιπεμπω ἐπιπεμψειεν κηδω κηδομενος συ ὑμων	plato
μελλω μελλω γαρ γαρ οὐν οὐν ἀσσα ἀττα συ ὑμιν ἐρω ἐρειν και και ἀλλος ἀλλα ἐφʼ ἐφʼ ὁς οἱς ἰσοω ἰσως βοαω βοησεσθε	plato
ὁστις ὁτι μεν μεν συ ὑμεις εἰμι ὠ ἀνηρ ἀνδρες ἀθηναιος Ἀθηναιοι πασχω πεπονθατε ὑπο ὑπο ὁ των ἐμεω ἐμων κατηγορος κατηγορων οὐ οὐκ οἰδα οἰδα	plato
ὁσπερ ὁπερ γαρ γαρ ἡδιστον ἡδιστον εἰμι ἐστιν οἰδα ᾐδειν ὁσιος ὁσιως ἐγω μοι και και δικαιοω δικαιως ἁπας ἁπαντα τον τον βιοω βιον βιοω βεβιωμενον	xenophon
ἀτεχνος ἀτεχνως οὐν οὐν ξενοω ξενως ἐχω ἐχω ὁ της ἐνθαδε ἐνθαδε λεξις λεξεως	plato
και και τυγχανω ἐτυχεν ἐγω ἡμων ὁ ἡ φυλη φυλη Ἀντιοχις Ἀντιοχις πρυτανευω πρυτανευουσα ὁστε ὁτε συ ὑμεις τους τους δεκαω δεκα στρατηγους στρατηγους τους τους οὐ οὐκ ἀναιρεω ἀνελομενους τους τους ἐκ ἐκ ὁ της ναυμαχια ναυμαχιας βουλευω ἐβουλευσασθε ἀθροος ἁθροους κρινω κρινειν παρανομος παρανομως ὡς ὡς ἐν ἐν ὁ τῳ ὑστερος ὑστερῳ χρονος χρονῳ πας πασιν συ ὑμιν δοκεω ἐδοξεν	plato
βουλομαι βουλοιμην μεν μεν οὐν οὐν ἀν ἀν οὑτος τουτο οὑτως οὑτως γιγνομαι γενεσθαι εἰ εἰ τις τι ἀμεινων ἀμεινον και και συ ὑμιν και και ἐγω ἐμοι και και πλεω πλεον τις τι ἐγω με ποιεω ποιησαι ἀπολογεομαι ἀπολογουμενον	plato
ὁστις ὁτι ἀκουω ἀκουοντες χαιρω χαιρουσιν ἐξεταζω ἐξεταζομενοις ὁ τοις οἰομαι οἰομενοις μεν μεν εἰμι εἰναι σοφος σοφοις εἰμι οὐσι δʼ δʼ οὐ οὐ	plato
οὐκουν οὐκουν εἰπερ εἰπερ δαιμων δαιμονας ἡγεομαι ἡγουμαι ὡς ὡς συ συ φημι φῃς εἰ εἰ μεν μεν θεος θεοι τις τινες εἰμι εἰσιν ὁ οἱ δαιμων δαιμονες τουτʼ τουτʼ ἀν ἀν εἰμι εἰη ὁ ὁ ἐγω ἐγω φημι φημι συ σε αἰνισσομαι αἰνιττεσθαι και και χαριεντιζομαι χαριεντιζεσθαι θεους θεους οὐ οὐχ ἡγεομαι ἡγουμενον φαινω φαναι ἐγω με θεους θεους αὐ2 αὐ ἡγεομαι ἡγεισθαι παλιν παλιν ἐπει ἐπειδηπερ γε γε δαιμων δαιμονας ἡγεομαι ἡγουμαι	plato
οἱος οἱουσπερ ἐγω ἐγω πολλακις πολλακις ἑωρακα ἑωρακα τις τινας ὁταν ὁταν κρινω κρινωνται δοκεω δοκουντας μεν μεν τις τι εἰμι εἰναι θαυμασιος θαυμασια δε δε ἐργαζομαι ἐργαζομενους ὡς ὡς δεινος δεινον τις τι οἰομαι οἰομενους πασχω πεισεσθαι εἰ εἰ ἀποθνησκω ἀποθανουνται ὡσπερ ὡσπερ ἀθανατος ἀθανατων εἰμι ἐσομενων ἀν ἀν συ ὑμεις αὐτους αὐτους μη μη ἀποκτεινω ἀποκτεινητε	plato
οἰομαι οἰμαι δε δε αὐτο αὐτο χαλεπον χαλεπον εἰμι εἰναι και και οὐ οὐ πανυ πανυ ἐγω με λανθανω λανθανει οἱον οἱον εἰμι ἐστιν	plato
ὁ τα τε τε γαρ γαρ ἀλλος ἀλλα εὐδαιμονεστεροι εὐδαιμονεστεροι εἰμι εἰσιν ὁ οἱ ἐκει ἐκει ὁ των ἐνθαδε ἐνθαδε και και ἠδος ἠδη τον τον λοιπον λοιπον χρονος χρονον ἀθανατοι ἀθανατοι εἰμι εἰσιν εἰπερ εἰπερ γε γε τα τα λεγω1 λεγομενα ἀληθης ἀληθη	plato
ἁτε ἁτε οὐν οὐν οἰομαι οἰμαι φιλοτιμος φιλοτιμοι εἰμι ὀντες και και σφοδροι σφοδροι και και πολυς πολλοι και και συντεινω συντεταμενως και και πιθανος πιθανως λεγω1 λεγοντες περι περι ἐμεω ἐμου ἐμπιπλημι ἐμπεπληκασιν συ ὑμων τα τα ἀτη ὠτα και και παλλω παλαι και και σφοδρος σφοδρως διαβαλλω διαβαλλοντες	plato
σοφον σοφον δε δε πως πως οὐ οὐκ ἀνα ἀν τις τις ἐοικοτως εἰκοτως ἀνηρ ἀνδρα φημι φησειεν εἰμι εἰναι ὁς ὁς ἐκ ἐξ ὁστις ὁτουπερ συνειμι2 ξυνιεναι τα τα λεγω1 λεγομενα ἀρχω ἠρξαμην οὐπωποτε οὐπωποτε διαλειπω διελειπον και και ζητεω ζητων και και μανθανω μανθανων ὁ ὁ τις τι δυναμαι ἐδυναμην ἀγαθος ἀγαθον	xenophon
ἐντευθεν ἐντευθεν ἐπʼ ἐπʼ ἀλλος ἀλλον εἰμι ᾐα ὁ των κενοω ἐκεινου δοκεω δοκουντων σοφος σοφωτερων εἰμι εἰναι και και ἐγω μοι ταὐτα ταὐτα οὑτος ταυτα δοκεω ἐδοξε και και ἐνταυθα ἐνταυθα ἐκεινος κἀκεινῳ και και ἀλλος ἀλλοις πολυς πολλοις ἀπεχθανομαι ἀπηχθομην	plato
συ συ δε δε εἰπε εἰπε εἰ εἰ τις τινα οἰδα οἰσθα ὑπʼ ὑπʼ ἐμεω ἐμου γιγνομαι γεγενημενον ἠ ἠ ἐκ ἐξ εὐσεβης εὐσεβους ἀνοσιος ἀνοσιον ἠ ἠ ἐκ ἐκ σωφρων σωφρονος ὑβριστην ὑβριστην ἠ ἠ ἐκ ἐξ εὐδιαιτος εὐδιαιτου πολυδαπανος πολυδαπανον ἠ ἠ ἐκ ἐκ μετριοποτης μετριοποτου οἰνοφλυξ οἰνοφλυγα ἠ ἠ ἐκ ἐκ φιλοπονος φιλοπονου μαλακον μαλακον ἠ ἠ ἀλλος ἀλλης πονηρος πονηρας ἡδονα ἡδονης ἡσσαομαι ἡττημενον	xenophon
ὁ της γαρ γαρ ἐμεω ἐμης εἰ εἰ δη δη τις τις εἰμι ἐστιν σοφια σοφια και και οἱος οἱα μαρτυς μαρτυρα συ ὑμιν παρεχω παρεξομαι τον τον θεον θεον τον τον ἐν ἐν δελφοι Δελφοις	plato
ἐμοι ἐμοι δε δε οὐτε οὐτε ἐξειμι2 ἐξιοντι ἑωθεν ἑωθεν οἰκοθεν οἰκοθεν ἐναντιοομαι ἠναντιωθη το το ὁ του θεαομαι θεου σημειον σημειον οὐτε οὐτε ἡνικα ἡνικα ἀναβαινω ἀνεβαινον ἐνταυθοι ἐνταυθοι ἐπι ἐπι το το δικαστηριον δικαστηριον οὐτε οὐτε ἐν ἐν ὁ τῳ λογος λογῳ οὐδαμος οὐδαμου μελλοντι μελλοντι τις τι ἐρω ἐρειν	plato
ταυτʼ ταυτʼ οὐν οὐν ἐγω ἐγω μεν μεν ἐτι ἐτι και και νυν νυν περιιων περιιων ζητεω ζητω και και ἐρευναω ἐρευνω κατα κατα τον τον θεον θεον και και ὁ των ἀστος ἀστων και και ξενοω ξενων ἀνα ἀν τις τινα οἰομαι οἰωμαι σοφον σοφον εἰμι εἰναι	plato
ἀλλʼ ἀλλʼ οὐδε οὐδε μεντοι μεντοι ὁστις ὁτι ἀδικος ἀδικως ἀποθνησκω ἀποθνῃσκω δια δια οὑτος τουτο μειων μειον φρονητεον φρονητεον	xenophon
το το δε δε μη μη ἀποθνησκω ἀποθανειν οὐ οὐκ οἰομαι ᾠετο λιπαρητεον λιπαρητεον εἰμι εἰναι ἀλλα ἀλλα και και καιρον καιρον ἠδος ἠδη νομιζω ἐνομιζεν ἑαυτου ἑαυτῳ τελευταω τελευταν	xenophon
πολλη πολλη μεντοι μεντἀν ἐγω με φιλοψυχια φιλοψυχια ἐχω ἐχοι εἰμι ὠ ἀνηρ ἀνδρες ἀθηναιος Ἀθηναιοι εἰ εἰ οὑτως οὑτως ἀλογιστος ἀλογιστος εἰμι εἰμι ὡστε ὡστε μη μη δυναμαι δυνασθαι λογιζομαι λογιζεσθαι ὁστις ὁτι συ ὑμεις μεν μεν εἰμι ὀντες πολιται πολιται ἐγω μου οὐ οὐχ οἱοι οἱοι τε τε γιγνομαι ἐγενεσθε φερω ἐνεγκειν τας τας ἐμας ἐμας διατριβας διατριβας και και τους τους λογοω λογους ἀλλʼ ἀλλʼ συ ὑμιν βαρυς βαρυτεραι γιγνομαι γεγονασιν και και ἐπιφθονος ἐπιφθονωτεραι ὡστε ὡστε ζητεω ζητειτε αὐτος αὐτων νυνι νυνι ἀπαλλασσω ἀπαλλαγηναι	plato
ἐφʼ ἐφʼ ὁς οἱς γε γε μην μην ἐργον ἐργοις κειμαι κειται θανατος θανατος ὁ ἡ ζημια ζημια ἱεροσυλια ἱεροσυλιᾳ τοιχωρυχια τοιχωρυχιᾳ ἀνδραποδιζω ἀνδραποδισει πολις πολεως προδοσια προδοσιᾳ οὐδʼ οὐδʼ αὐτοι αὐτοι ὁ οἱ ἀντιδικος ἀντιδικοι οὑτος τουτων πραξαι πραξαι τις τι κατʼ κατʼ ἐμεω ἐμου φημι φασιν	xenophon
ὁμοω ὁμως οὑτος τουτο μεν μεν εἰμι ἰτω ὁπη ὁπῃ ὁ τῳ θεαω θεῳ φιλος φιλον ὁ τῳ δε δε νομος νομῳ πειστεος πειστεον και και ἀπολογητεον ἀπολογητεον	plato
ὁ τους γε γε μην μην νεος νεους πως πως ἀν ἀν διαφθειρω διαφθειροιμι καρτερια καρτεριαν και και εὐτελεια εὐτελειαν προσεθιζω προσεθιζων	xenophon
νυν νυν δε δε εἰ εἰ ἐτι ἐτι προβαινω προβησεται ὁ ἡ ἡλικια ἡλικια οἰδʼ οἰδʼ ὁστις ὁτι ἀναγκη ἀναγκη εἰμι ἐσται τα τα ὁ του γηρας γηρως ἐπιτελεω ἐπιτελεισθαι και και ὁραω ὁραν τε τε χειρων χειρον και και ἀκουω ἀκουειν ἡσσων ἡττον και και δυσμαθης δυσμαθεστερον εἰμι εἰναι και και ὁς ὡν μανθανω ἐμαθον ἐπιλησμων ἐπιλησμονεστερον	xenophon
και και ἀλλος ἀλλους πολλους πολλους ἐγω ἐγω ἐχω ἐχω συ ὑμιν εἰπον εἰπειν ὁς ὡν τις τινα χρη ἐχρην μαλιστα μαλιστα μεν μεν ἐν ἐν ὁ τῳ ἑαυτου ἑαυτου λογος λογῳ παρεχω παρασχεσθαι μελω Μελητον μαρτυς μαρτυρα	plato
εἰ εἰ δε δε τις τις ἐγω με φημι φησιν ἀλλος ἀλλα λεγω1 λεγειν ἠ ἠ οὑτος ταυτα οὐδεν οὐδεν λεγω1 λεγει	plato
και και τουτʼ τουτʼ εἰμι ἐστιν ὁ ὁ ἐμε ἐμε αἱρεω αἱρει ἐαν ἐανπερ αἱρεω αἱρῃ οὐ οὐ μελητος Μελητος οὐδε οὐδε ἀνυτος Ἀνυτος ἀλλʼ ἀλλʼ ὁ ἡ ὁ των πολυς πολλων διαβολη διαβολη τε τε και και φθονος φθονος	plato
τιμαω τιμαται δʼ δʼ οὐν οὐν ἐγω μοι ὁ ὁ ἀνηρ ἀνηρ θανατοω θανατου	plato
εὐ εὐ γε γε νη νη την την ἡρα Ἡραν λεγω1 λεγεις και και πολλην πολλην ἀφθονια ἀφθονιαν ὁ των ὠφελεω ὠφελουντων	plato
οὐδε οὐδε γαρ γαρ ἀναβιβαζω ἀναβιβασασθαι οἱον οἱον τʼ τʼ ἐστιν ἐστιν αὐτος αὐτων ἐνταυθοι ἐνταυθοι οὐδʼ οὐδʼ ἐλεγχω ἐλεγξαι οὐδεις οὐδενα ἀλλʼ ἀλλʼ ἀναγκη ἀναγκη ἀτεχνος ἀτεχνως ὡσπερ ὡσπερ σκιαμαχεω σκιαμαχειν ἀπολογουμενον ἀπολογουμενον τε τε και και ἐλεγχω ἐλεγχειν μηδενος μηδενος ἀποκρινω ἀποκρινομενου	plato
ὁμοιοω ὁμοιως γαρ γαρ ἀν ἀν ἀτοπος ἀτοπον εἰμι εἰη ὡσπερ ὡσπερ ἀν ἀν εἰ εἰ τις τις ἱππος ἱππων μεν μεν παις παιδας ἡγεομαι ἡγοιτο ἠ ἠ και και ὀνος ὀνων τους τους ἡμιονος ἡμιονους ἱππος ἱππους δε δε και και ὀνος ὀνους μη μη ἡγεομαι ἡγοιτο εἰμι εἰναι	plato
οὐ οὐ γαρ γαρ ἐπι ἐπι οὑτος τουτῳ καθιημι καθηται ὁ ὁ δικαστης δικαστης ἐπι ἐπι ὁ τῳ καταχαριζομαι καταχαριζεσθαι τα τα δικαιος δικαια ἀλλʼ ἀλλʼ ἐπι ἐπι ὁ τῳ κρινω κρινειν οὑτος ταυτα	plato
ἐτι ἐτι γαρ γαρ και και νυν νυν πολυ πολυ καλος καλλιους ὑμνος ὑμνους παρεχω παρεχεται ὀδυσσευς Ὀδυσσεως ὁ του ἀδικος ἀδικως ἀποκτεινω ἀποκτειναντος αὐτος αὐτον	xenophon
ἐμοι ἐμοι δε δε τουτʼ τουτʼ εἰμι ἐστιν ἐκ ἐκ παιδος παιδος ἀρχω ἀρξαμενον φωνη φωνη τις τις γιγνομαι γιγνομενη ἡ ἡ ὁταν ὁταν γιγνομαι γενηται ἀει ἀει ἀποτρεπω ἀποτρεπει ἐγω με οὑτος τουτο ὁ ὁ ἀν ἀν μελλω μελλω πρασσω πραττειν προτρεπω προτρεπει δε δε οὐποτε οὐποτε	plato
οὑτος ταυτα δʼ δʼ εἰπων εἰπων οὐ οὐκ ψευδω ἐψευσατο ἀλλʼ ἀλλʼ ὁ ὁ νεανισκος νεανισκος ἡσθεις ἡσθεις οἰνος οἰνῳ οὐτε οὐτε νυκτος νυκτος οὐτε οὐτε ἡμερος ἡμερας παυω ἐπαυετο πινω πινων και και τελος τελος οὐτε οὐτε ὁ τῃ ἑαυτου ἑαυτου πολεω πολει οὐτε οὐτε ὁ τοις φιλος φιλοις οὐτε οὐτε ἑαυτου αὑτῳ ἀξιος ἀξιος οὐδενος οὐδενος γιγνομαι ἐγενετο	xenophon
προ προ οὐν οὐν ὁ των κακοω κακων ὁς ὡν οἰδα οἰδα ὁστις ὁτι κακος κακα εἰμι ἐστιν ἁ ἁ μη μη οἰδα οἰδα εἰ εἰ και και ἀγαθα ἀγαθα εἰμι ὀντα τυγχανω τυγχανει οὐδεποτε οὐδεποτε φοβεω φοβησομαι οὐδε οὐδε φευγω φευξομαι	plato
τις τινα μεν μεν γαρ γαρ ἐφιστημι ἐπιστασθε ἡσσων ἡττον ἐμεω ἐμου δουλευω δουλευοντα ὁ ταις ὁ του σωμα σωματος ἐπιθυμια ἐπιθυμιαις	xenophon
τοτε τοτε μεντοι μεντοι ἐγω ἐγω οὐ οὐ λογος λογῳ ἀλλʼ ἀλλʼ ἐργον ἐργῳ αὐ2 αὐ ἐνδεικνυμι ἐνεδειξαμην ὁστις ὁτι ἐμοι ἐμοι θανατοω θανατου μεν μεν μελω μελει εἰ εἰ μη μη ἀγροικος ἀγροικοτερον εἰμι ἠν εἰπον εἰπειν οὐδʼ οὐδʼ ὁτιουν ὁτιουν ὁ του δε δε μηδεν μηδεν ἀδικος ἀδικον μηδʼ μηδʼ ἀνοσιος ἀνοσιον ἐργαζομαι ἐργαζεσθαι οὑτος τουτου δε δε το το πας παν μελω μελει	plato
αὐτοι αὐτοι μεν μεν γαρ γαρ ὁ οἱ διαφθειρω διεφθαρμενοι ταχʼ ταχʼ ἀν ἀν λογος λογον ἐχω ἐχοιεν βοηθεω βοηθουντες	plato
οὐ οὐ γαρ γαρ ἐμον ἐμον ἐρω ἐρω τον τον λογος λογον ὁν ὁν ἀν ἀν λεγω1 λεγω ἀλλʼ ἀλλʼ εἰς εἰς ἀξιοχρεως ἀξιοχρεων συ ὑμιν τον τον λεγω1 λεγοντα ἀναφερω ἀνοισω	plato
χωρις χωρις δε δε ὁ της δοξα δοξης εἰμι ὠ ἀνηρ ἀνδρες οὐδε οὐδε δικαιον δικαιον ἐγω μοι δοκεω δοκει εἰμι εἰναι δεομαι δεισθαι ὁ του δικαστης δικαστου οὐδε οὐδε δεω1 δεομενον ἀποφευγω ἀποφευγειν ἀλλα ἀλλα διδασκω διδασκειν και και πειθω πειθειν	plato
ὡσπερ ὡσπερ οὐν οὐν ἀνα ἀν εἰ εἰ ὁ τῳ εἰμι ὀντι ξενος ξενος τυγχανω ἐτυγχανον εἰμι ὠν συγγιγνωσκω συνεγιγνωσκετε δηπου δηπου ἀνα ἀν ἐγω μοι εἰ εἰ ἐν ἐν ἐκεινος ἐκεινῃ ὁ τῃ φωνεω φωνῃ τε τε και και ὁ τῳ τροπος τροπῳ λεγω1 ἐλεγον ἐν ἐν ὁς οἱσπερ τρεφω ἐτεθραμμην και και δη δη και και νυν νυν οὑτος τουτο συ ὑμων δεω1 δεομαι δικαιος δικαιον ὁς ὡς γε γε ἐγω μοι δοκεω δοκω τον τον μεν μεν τροπος τροπον ὁ της λεξις λεξεως ἐανἰσως ἐανἰσως μεν μεν γαρ γαρ χειροω χειρων ἰσοω ἰσως δε δε βελτιοω βελτιων ἀν ἀν εἰηαὐτο εἰηαὐτο δε δε οὑτος τουτο σκοπαω σκοπειν και και οὑτος τουτῳ τον τον νεω νουν προσεχω προσεχειν εἰ εἰ δικαιος δικαια λεγω1 λεγω ἠ ἠ μη μη	plato
και και πολυν πολυν μεν μεν χρονος χρονον ἀπορεω ἠπορουν τις τι ποτε ποτε λεγω1 λεγει	plato
το το μεν μεν μη μη ἀγανακτεω ἀγανακτειν εἰμι ὠ ἀνηρ ἀνδρες ἀθηναιος Ἀθηναιοι ἐπι ἐπι οὑτος τουτῳ ὁ τῳ γιγνομαι γεγονοτι ὁστις ὁτι ἐγω μου καταψηφιζομαι κατεψηφισασθε ἀλλος ἀλλα συ τε ἐγω μοι πολλα πολλα συμβαλλω συμβαλλεται και και οὐ οὐκ ἀνελπιστον ἀνελπιστον ἐγω μοι γιγνομαι γεγονεν το το γεγονος γεγονος οὑτος τουτο ἀλλα ἀλλα πολυ πολυ μαλλον μαλλον θαυμαζω θαυμαζω ἑκατερος ἑκατερων ὁ των ψηφος ψηφων τον τον γιγνομαι γεγονοτα ἀριθμος ἀριθμον	plato
διασκοπεω διασκοπων οὐν οὐν τουτονὀνοματι τουτονὀνοματι γαρ γαρ οὐδεν οὐδεν δεω1 δεομαι λεγω1 λεγειν εἰμι ἠν δε δε τις τις ὁ των πολιτικος πολιτικων προς προς ὁν ὁν ἐγω ἐγω σκοπαω σκοπων τοιουτον τοιουτον τις τι πασχω ἐπαθον εἰμι ὠ ἀνηρ ἀνδρες ἀθηναιος Ἀθηναιοι και και διαλεγω διαλεγομενος αὐτῳἐδοξε αὐτῳἐδοξε ἐγω μοι οὑτος οὑτος ὁ ὁ ἀνηρ ἀνηρ δοκεω δοκειν μεν μεν εἰμι εἰναι σοφος σοφος ἀλλος ἀλλοις τε τε πολυς πολλοις ἀνθρωπος ἀνθρωποις και και μαλιστα μαλιστα ἑαυτου ἑαυτῳ εἰμι εἰναι δʼ δʼ οὐ οὐ	plato
