οὐτε οὐτε γαρ γαρ ἐν ἐν δικειν δικῃ οὐτʼ οὐτʼ ἐν ἐν πολεμος πολεμῳ οὐτʼ οὐτʼ ἐμε ἐμε οὐτʼ οὐτʼ ἀλλος ἀλλον οὐδεις οὐδενα δεω1 δει οὑτος τουτο μηχαναομαι μηχανασθαι ὁπως ὁπως ἀποφευγω ἀποφευξεται πας παν ποιεω ποιων θανατος θανατον	plato
εἰ εἰ γαρ γαρ οἰομαι οἰεσθε ἀποκτεινω ἀποκτεινοντες ἀνθρωπος ἀνθρωπους ἐπωχατο ἐπισχησειν ὁ του ὀνειδιζω ὀνειδιζειν τινα τινα συ ὑμιν ὁστις ὁτι οὐ οὐκ ὀρθοω ὀρθως ζαω ζητε οὐ οὐ καλος καλως διανοεομαι διανοεισθε	plato
ὁ τῳ εἰμι ὀντι γαρ γαρ κινδυνευω κινδυνευω οὑτος ταυτην εἰμι εἰναι σοφος σοφος	plato
οὐδε οὐδε γαρ γαρ ἀν ἀν δηπου δηπου πρεπω πρεποι εἰμι ὠ ἀνηρ ἀνδρες ὁδε τῃδε ὁ τῃ ἡλικια ἡλικιᾳ ὡσπερ ὡσπερ μειρακιον μειρακιῳ πλασσω πλαττοντι λογοω λογους εἰς εἰς συ ὑμας εἰσειμι εἰσιεναι	plato
και και γαρ γαρ εἰμι εἰμι ἠδος ἠδη ἐνταυθα ἐνταυθα ἐν ἐν ὁς ᾡ μαλιστα μαλιστα ἀνθρωπος ἀνθρωποι χρησμωιδεω χρησμῳδουσιν ὁταν ὁταν μελλω μελλωσιν ἀποθνησκω ἀποθανεισθαι	plato
νυν νυν δε δε ὡς ὡς ἐοικα ἐοικεν εἰ εἰ τριακοντα τριακοντα μονος μοναι μεταπιπτω μετεπεσον ὁ των ψηφος ψηφων ἀποφευγω ἀπεπεφευγη ἀνα ἀν	plato
το το γαρ γαρ συ τοι θανατος θανατον δειδω δεδιεναι εἰμι ὠ ἀνηρ ἀνδρες οὐδεν οὐδεν ἀλλος ἀλλο ἐστιν ἐστιν ἠ ἠ δοκεω δοκειν σοφον σοφον εἰμι εἰναι μη μη εἰμι ὀντα	plato
πολυς πολλου γε γε δεω1 δει εἰμι ὠ ἀνηρ ἀνδρες ἀθηναιος Ἀθηναιοι	plato
ἀλλα ἀλλα και και συ ὑμας χρη χρη εἰμι ὠ ἀνηρ ἀνδρες δικαστης δικασται εὐελπις εὐελπιδας εἰμι εἰναι προς προς τον τον θανατος θανατον και και ἱημι ἑν τις τι οὑτος τουτο διανοεομαι διανοεισθαι ἀληθης ἀληθες ὁστις ὁτι οὐ οὐκ εἰμι ἐστιν ἀνδρι ἀνδρι ἀγαθος ἀγαθῳ κακον κακον οὐδεν οὐδεν οὐτε οὐτε ζαω ζωντι οὐτε οὐτε τελευταω τελευτησαντι οὐδε οὐδε ἀμελεω ἀμελειται ὑπο ὑπο θεαω θεων τα τα οὑτος τουτου πραγμα πραγματα	plato
οὑτος ταυτι ἐγω μοι δοκεω δοκει δικαιος δικαια λεγω1 λεγειν ὁ ὁ λεγω1 λεγων κἀγω κἀγω συ ὑμιν πειραω πειρασομαι ἀποδεικνυμι ἀποδειξαι τις τι ποτʼ ποτʼ ἐστιν ἐστιν οὑτος τουτο ὁ ὁ ἐμοι ἐμοι ποιεω πεποιηκεν ὁ το τε τε ὀνομα ὀνομα και και την την διαβολη διαβολην	plato
οὐ οὐ γαρ γαρ δηπου δηπου σευω σου γε γε οὐδεν οὐδεν ὁ των ἀλλος ἀλλων περισσος περιττοτερον πραγματευομαι πραγματευομενου ἐπειτα ἐπειτα τοσουτος τοσαυτη φημη φημη τε τε και και λογος λογος γιγνομαι γεγονεν εἰ εἰ μη μη τις τι πρασσω ἐπραττες ἀλλοιος ἀλλοιον ἠ ἠ ὁ οἱ πολυς πολλοι	plato
ἀλλα ἀλλα οὑτος τουτου πας παν ἐναντιος τοὐναντιον εὑρισκω εὑρησετε εἰμι ὠ ἀνηρ ἀνδρες πας παντας ἐμοι ἐμοι βοηθεω βοηθειν ἑτοιμος ἑτοιμους ὁ τῳ διαφθειρω διαφθειροντι ὁ τῳ κακα κακα ἐργαζομαι ἐργαζομενῳ τους τους οἰκειοω οἰκειους αὐτος αὐτων ὁς ὡς φημι φασι μελητος Μελητος και και ἀνυτος Ἀνυτος	plato
συ συ δε δε ἐγω ἡμιν ἀποκρινω ἀποκριναι εἰμι ὠ μελω Μελητε	plato
ἀλλα ἀλλα δια δια τις τι δη δη ποτε ποτε μετʼ μετʼ ἐμεω ἐμου χαιρουσι χαιρουσι τις τινες πολυν πολυν χρονος χρονον διατριβω διατριβοντες	plato
παντως παντως οὐ οὐ δηπου δηπου οὑτος τουτου γε γε ἑνεκα ἑνεκα ὁ οἱ ἐκει ἐκει ἀποκτεινω ἀποκτεινουσι	plato
οὐ οὐ γαρ γαρ ἀνθρωπινος ἀνθρωπινῳ ἐοικα ἐοικε το το ἐμε ἐμε ὁ των μεν μεν ἐμαυτου ἐμαυτου πας παντων ἀμελεω ἠμεληκεναι και και ἀνεχω ἀνεχεσθαι ὁ των οἰκεω οἰκειων ἀμελεω ἀμελουμενων τοσουτος τοσαυτα ἠδος ἠδη ἐτος ἐτη το το δε δε ὑμετερος ὑμετερον πρασσω πραττειν ἀει ἀει ἰδιος ἰδιᾳ ἑκαστος ἑκαστῳ προσειμι1 προσιοντα ὡσπερ ὡσπερ πατηρ πατερα ἠ ἠ ἀδελφον ἀδελφον πρεσβυς πρεσβυτερον πειθω πειθοντα ἐπιμελεομαι ἐπιμελεισθαι ἀρεταω ἀρετης	plato
προτερος πρωτον μεν μεν γαρ γαρ κελευω κελευομενος ὑποτιμαομαι ὑποτιμασθαι οὐτε οὐτε αὐτος αὐτος ὑποτιμαομαι ὑπετιμησατο οὐτε οὐτε τους τους φιλοω φιλους ἐαω εἰασεν ἀλλα ἀλλα και και λεγω1 ἐλεγεν ὁστις ὁτι το το ὑποτιμαομαι ὑποτιμασθαι ὁμολογεω ὁμολογουντος εἰμι εἰη ἀδικεω ἀδικειν	xenophon
οὐκουν οὐκουν χρη χρη οὐτε οὐτε ἐγω ἡμας ἐθιζω ἐθιζειν συ ὑμας ἐπιορκεω ἐπιορκειν οὐθʼ οὐθʼ συ ὑμας ἐθιζω ἐθιζεσθαι	plato
και και ὀμνυμι ὀμωμοκεν οὐ οὐ χαριζομαι χαριεισθαι ὁς οἱς ἀν ἀν δοκεω δοκῃ αὐτος αὐτῳ ἀλλα ἀλλα δικαζω δικασειν κατα κατα τους τους νομος νομους	plato
σωκρατης Σωκρατης δε δε δια δια το το μεγαλυνω μεγαλυνειν ἑαυτον ἑαυτον ἐν ἐν ὁ τῳ δικαστηριον δικαστηριῳ φθονος φθονον ἐπαγω ἐπαγομενος μαλλον μαλλον καταψηφιζομαι καταψηφισασθαι ἑαυτου ἑαυτου ποιεω ἐποιησε τους τους δικαστης δικαστας	xenophon
ἀλλʼ ἀλλʼ ἐγω ἐγω δια δια παντος παντος ὁ του βιοω βιου δημοσιος δημοσιᾳ τε τε εἰ εἰ που που τις τι πρασσω ἐπραξα τοιουτος τοιουτος φαινω φανουμαι και και ἰδιος ἰδιᾳ ὁ ὁ αὐτος αὐτος οὑτος οὑτος οὐδενι οὐδενι πωποτε πωποτε συγχωρεω συγχωρησας οὐδεν οὐδεν παρα παρα το το δικαιος δικαιον οὐτε οὐτε ἀλλος ἀλλῳ οὐτε οὐτε οὑτος τουτων οὐδενι οὐδενι οὑς οὑς δη δη διαβαλλω διαβαλλοντες ἐγω ἐμε φημι φασιν ἐμους ἐμους μαθητας μαθητας εἰμι εἰναι	plato
ἀλλα ἀλλα ἐγω μοι εἰμι ὠ ἀνηρ ἀνδρες παραμενω παραμεινατε τοσουτος τοσουτον χρονος χρονον	plato
οὑτος ταυτα γαρ γαρ ἐγω ἐγω ἀκουω ἀκουσας ἐνθυμεομαι ἐνεθυμουμην οὑτωσι οὑτωσι	plato
το το δε δε τους τους ἀλλος ἀλλους μεν μεν τας τας εὐπαθεια εὐπαθειας ἐκ ἐκ ὁ της ἀγοραζω ἀγορας πολυτελης πολυτελεις ποριζω ποριζεσθαι ἐμε ἐμε δε δε ἐκ ἐκ ὁ της ψυχη ψυχης ἀνω1 ἀνευ δαπαναω δαπανης ἡδυς ἡδιους κενοω ἐκεινων μηχαναομαι μηχανασθαι	xenophon
και και μεντοι μεντοι και και πανυ πανυ εἰμι ὠ ἀνηρ ἀνδρες ἀθηναιος Ἀθηναιοι οὑτος τουτο συ ὑμων δεω1 δεομαι και και παριημι παριεμαι	plato
παντως παντως δε δε παρειμι1 παρεισιν αὐτος αὐτων πολλοι πολλοι ἐνταυθοι ἐνταυθοι οὑς οὑς ἐγω ἐγω ὁραω ὁρω προτερος πρωτον μεν μεν κριτων Κριτων οὑτος οὑτοσι ἐμος ἐμος ἡλικιωτης ἡλικιωτης και και δημοτης δημοτης κριτοβουλος Κριτοβουλου ὁδε τουδε πατηρ πατηρ ἐπειτα ἐπειτα λυσανιας Λυσανιας ὁ ὁ σφηττιος Σφηττιος αἰσχινης Αἰσχινου ὁδε τουδε πατηρ πατηρ ἐτι ἐτι δʼ δʼ ἀντιφων Ἀντιφων ὁ ὁ Κηφισιευς Κηφισιευς οὑτος οὑτοσι ἐπιγενης Ἐπιγενους πατηρ πατηρ ἀλλος ἀλλοι τοινυν τοινυν οὑτος οὑτοι ὁς ὡν ὁ οἱ ἀδελφοι ἀδελφοι ἐν ἐν οὑτος ταυτῃ ὁ τῃ διατριβω διατριβῃ γιγνομαι γεγονασιν νικοστρατος Νικοστρατος Θεοζοτιδου Θεοζοτιδου ἀδελφος ἀδελφος Θεοδοτουκαι Θεοδοτουκαι ὁ ὁ μεν μεν θεοδοτος Θεοδοτος τελευταω τετελευτηκεν ὡστε ὡστε οὐ οὐκ ἀν ἀν ἐκεινος ἐκεινος γε γε αὐτος αὐτου καταδεηθειηκαι καταδεηθειηκαι παραλιος Παραλιος ὁδε ὁδε ὁ ὁ δημοδοκος Δημοδοκου ἱημι οὑ εἰμι ἠν θεαγης Θεαγης ἀδελφος ἀδελφος	plato
και και νη νη τον τον κυναω κυνα εἰμι ὠ ἀνηρ ἀνδρες ἀθηναιος Ἀθηναιοι δεω1 δει γαρ γαρ προς προς συ ὑμας ἀληθης τἀληθη λεγεινἠ λεγεινἠ μην μην ἐγω ἐγω ἐπαθον ἐπαθον τις τι τοιουτος τοιουτον	plato
ἐγω ἐγω δε δε γε γε εἰμι ὠ ἀνηρ ἀνδρες ἀθηναιος Ἀθηναιοι ἀδικεω ἀδικειν φημι φημι μελω Μελητον ὁστις ὁτι σπουδαζω σπουδῃ χαριεντιζομαι χαριεντιζεται ῥαιδιος ῥᾳδιως εἰς εἰς ἀγων ἀγωνα καθιστας καθιστας ἀνθρωπος ἀνθρωπους περι περι πραγμα πραγματων προσποιεω προσποιουμενος σπουδαζω σπουδαζειν και και κηδω κηδεσθαι ὁς ὡν οὐδεν οὐδεν οὑτος τουτῳ πωποτε πωποτε μελω ἐμελησεν	plato
οὐ οὐ γαρ γαρ εἰμι ἐστι ἐγω μοι χρημα χρηματα ὁποθεν ὁποθεν ἐκτινω ἐκτεισω	plato
πινω ποθεν ὁ αἱ διαβολη διαβολαι συ σοι οὑτος αὑται γιγνομαι γεγονασιν	plato
ὡς ὡς δε δε οὑτος τουτο οὑτως οὑτως ἐχω ἐχει πειραω πειρασομαι και και συ ὑμιν ἐπιδεικνυμι ἐπιδειξαι	plato
ὁ ὁ δε δε και και ἐν ἐν ὁ τοις ἐμπροσθεν ἐμπροσθεν λεγω1 ἐλεγον ὁστις ὁτι πολυς πολλη ἐγω μοι ἀπεχθεια ἀπεχθεια γιγνομαι γεγονεν και και προς προς πολυς πολλους εὐ εὐ οἰδα ἰστε ὁστις ὁτι ἀληθης ἀληθες εἰμι ἐστιν	plato
ἐαν ἐαν δια δια ὁ των αὐτος αὐτων λογαω λογων ἀκουητε ἀκουητε ἐγω μου ἀπολογεομαι ἀπολογουμενου διʼ διʼ ὁς ὡνπερ ἐθω εἰωθα λεγω1 λεγειν και και ἐν ἐν ἀγοραζω ἀγορᾳ ἐπι ἐπι ὁ των τραπεζοω τραπεζων ἱνα ἱνα συ ὑμων πολλοι πολλοι ἀκουω ἀκηκοασι και και ἀλλοθι ἀλλοθι μητε μητε θαυμαζω θαυμαζειν μητε μητε θορυβεω θορυβειν οὑτος τουτου ἑνεκα ἑνεκα	plato
τουτʼ τουτʼ εἰμι ἐστιν ὁ ὁ ἐγω μοι ἐναντιοομαι ἐναντιουται τα τα πολιτικα πολιτικα πρασσω πραττειν και και παγκαλος παγκαλως γε γε ἐγω μοι δοκεω δοκει ἐναντιοομαι ἐναντιουσθαι	plato
εἰμι ὠ σωκρατης Σωκρατες νυν νυν μεν μεν ἀνυτος Ἀνυτῳ οὐ οὐ πειθω πεισομεθα ἀλλʼ ἀλλʼ ἀφιεμεν ἀφιεμεν συ σε ἐπι ἐπι οὑτος τουτῳ μεντοι μεντοι ἐφʼ ἐφʼ ὁστε ᾡτε μηκετι μηκετι ἐν ἐν οὑτος ταυτῃ ὁ τῃ ζητεω ζητησει διατριβω διατριβειν μηδε μηδε φιλοσοφεω φιλοσοφειν	plato
τ τ τις τι ἀξιος ἀξιος εἰμι εἰμι πασχω παθειν ἠ ἠ ἀποτινω ἀποτεισαι ὁστις ὁτι μαθων μαθων ἐν ἐν ὁ τῳ βιος βιῳ οὐ οὐχ ἡσυχια ἡσυχιαν ἀγω ἠγον ἀλλʼ ἀλλʼ ἀμελεω ἀμελησας ὁς ὡνπερ ὁ οἱ πολυς πολλοι χρηματισμος χρηματισμου τε τε και και οἰκονομια οἰκονομιας και και στρατηγιαω στρατηγιων και και δημηγορια δημηγοριων και και ὁ των ἀλλος ἀλλων ἀρχη ἀρχων και και συνωμοσια συνωμοσιων και και στασις στασεων ὁ των ἐν ἐν ὁ τῃ πολεω πολει γιγνομαι γιγνομενων ἡγεομαι ἡγησαμενος ἐμαυτον ἐμαυτον ῳ ῳ εἰμι ὀντι ἐπιεικης ἐπιεικεστερον εἰμι εἰναι ἠ ἠ ὡστε ὡστε εἰς εἰς ταυτʼ ταυτʼ εἰμι ἰοντα σωζω σῳζεσθαι ἐνταυθα ἐνταυθα μεν μεν οὐ οὐκ εἰμι ᾐα ὁ οἱ ἐλθων ἐλθων μητε μητε συ ὑμιν μητε μητε ἐμαυτου ἐμαυτῳ μελλω ἐμελλον μηδεν μηδεν ὀφελος ὀφελος εἰμι εἰναι ἐπι ἐπι δε δε το το ἰδιος ἰδιᾳ ἑκαστος ἑκαστον ἰων ἰων εὐεργετεω εὐεργετειν την την μεγας μεγιστην εὐεργεσια εὐεργεσιαν ὡς ὡς ἐγω ἐγω φημι φημι ἐνταυθα ἐνταυθα εἰμι ᾐα ἐπιχειρεω ἐπιχειρων ἑκαστος ἑκαστον συ ὑμων πειθω πειθειν μη μη προτερος προτερον μητε μητε ὁ των ἑαυτου ἑαυτου μηδενος μηδενος ἐπιμελεομαι ἐπιμελεισθαι πριν πριν ἑαυτου ἑαυτου ἐπιμελεομαι ἐπιμεληθειη ὁπως ὁπως ὡς ὡς βελτιστος βελτιστος και και φρονιμος φρονιμωτατος εἰμι ἐσοιτο μητε μητε ὁ των ὁ της πολις πολεως πριν πριν αὐτος αὐτης ὁ της πολις πολεως ὁ των τε τε ἀλλος ἀλλων οὑτως οὑτω κατα κατα τον τον αὐτον αὐτον τροπος τροπον ἐπιμελεισθαιτι ἐπιμελεισθαιτι οὐν οὐν εἰμι εἰμι ἀξιος ἀξιος πασχω παθειν τοιουτος τοιουτος εἰμι ὠν	plato
ἐπειτα ἐπειτα ὁ των ἑταιρος ἑταιρων ἐκκλεπτω ἐκκλεψαι βουλομαι βουλομενων αὐτον αὐτον οὐ οὐκ ἐφεπω ἐφειπετο ἀλλα ἀλλα και και ἐπισκωπτω ἐπισκωψαι δοκεω ἐδοκει ἐρομαι ἐρομενος εἰ εἰ που που εἰδειεν εἰδειεν τις τι χωρεω χωριον ἐσσομαι ἐξω ὁ της ἀττικος Ἀττικης ἐνθα ἐνθα οὐ οὐ προσβατον προσβατον θανατος θανατῳ	xenophon
εἰ εἰ μεν μεν γαρ γαρ εἰμι ἠν ἐγω μοι χρημα χρηματα τιμαω ἐτιμησαμην ἀν ἀν χρημα χρηματων ὁσος ὁσα μελλω ἐμελλον ἐκτινω ἐκτεισειν οὐδεν οὐδεν γαρ γαρ ἀν ἀν βλαπτω ἐβλαβην	plato
τοτʼ τοτʼ ἐγω ἐγω μονος μονος ὁ των πρυτανις πρυτανεων ἐναντιοομαι ἠναντιωθην συ ὑμιν μηδεν μηδεν ποιεω ποιειν παρα παρα τους τους νομος νομους και και ἐναντιος ἐναντια ψηφιζομαι ἐψηφισαμην	plato
εὐ εὐ γαρ γαρ οἰδα ἰστε εἰμι ὠ ἀνηρ ἀνδρες ἀθηναιος Ἀθηναιοι εἰ εἰ ἐγω ἐγω παλλω παλαι ἐπιχειρεω ἐπεχειρησα πρασσω πραττειν τα τα πολιτικα πολιτικα πραγμα πραγματα παλλω παλαι ἀν ἀν ἀπολλυμι ἀπολωλη και και οὐτʼ οὐτʼ ἀν ἀν συ ὑμας ὠφελεω ὠφεληκη οὐδεν οὐδεν οὐτʼ οὐτʼ ἀν ἀν ἐμαυτου ἐμαυτον	plato
ἀπειμι2 ἀπῃα οὐν οὐν και και ἐντευθεν ἐντευθεν ὁ τῳ αὐτος αὐτῳ οἰομαι οἰομενος περιγιγνομαι περιγεγονεναι ὁς ᾡπερ και και ὁ των πολιτικος πολιτικων	plato
ἀλλʼ ἀλλʼ εἰπον εἰπε ἀγαθος ὠγαθε τις τις αὐτους αὐτους ἀμεινων ἀμεινους ποιεω ποιει	plato
ἀν ἀν γαρ γαρ νυν νυν κατακρινω κατακριθῃ ἐγω μου δηλος δηλον ὁστις ὁτι ἐξεστι ἐξεσται ἐγω μοι ὁ τῃ τελευταω τελευτῃ χραω1 χρησθαι ἡ ἡ ῥαιδιος ῥᾳστη μεν μεν ὑπο ὑπο ὁ των οὑτος τουτου ἐπιμελεομαι ἐπιμεληθεντων κρινω κεκριται ἀπραγμων ἀπραγμονεστατη δε δε ὁ τοις φιλος φιλοις πλειστος πλειστον δε δε ποθος ποθον ἐμποιεω ἐμποιουσα ὁ των τελευταω τελευτωντων	xenophon
δικαστης δικαστου μεν μεν γαρ γαρ οὑτος αὑτη ἀρετη ἀρετη ῥητωρ ῥητορος δε δε ἀληθης τἀληθη λεγω1 λεγειν	plato
ὁδε ὁδε δε δε ἀδειμαντος Ἀδειμαντος ὁ ὁ ἀριστων Ἀριστωνος ἱημι οὑ ἀδελφος ἀδελφος οὑτοσι οὑτοσι πλατων Πλατων και και Αἰαντοδωρος Αἰαντοδωρος ἱημι οὑ ἀπολλοδωρος Ἀπολλοδωρος ὁδε ὁδε ἀδελφος ἀδελφος	plato
δηλος δηλον γαρ γαρ ὁστις ὁτι ἐαν ἐαν μανθανω μαθω παυω παυσομαι ὁ ὁ γε γε ἀεκων ἀκων ποιεω ποιω	plato
ἀπιστος ἀπιστος γʼ γʼ εἰμι εἰ εἰμι ὠ μελω Μελητε και και οὑτος ταυτα μεντοι μεντοι ὡς ὡς ἐμοι ἐμοι δοκεω δοκεις σαυτου σαυτῳ	plato
το το δε δε οὐ οὐκ εἰμι ἐστιν εἰμι ὠ ἀνηρ ἀνδρες ἀθηναιος Ἀθηναιοι τοιουτος τοιουτον ἀλλα ἀλλα τοιοσδε τοιονδε μαλλον μαλλον	plato
εἰ εἰ οὐν οὐν συ ὑμων ὁ οἱ δοκεω δοκουντες διαφερω διαφερειν εἰτε εἰτε σοφια σοφιᾳ εἰτε εἰτε ἀνδρεια ἀνδρειᾳ εἰτε εἰτε ἀλλος ἀλλῃ ὁστις ᾑτινιουν ἀρεταω ἀρετῃ τοιουτος τοιουτοι εἰμι ἐσονται αἰσχρον αἰσχρον ἀν ἀν εἰμι εἰη	plato
ἐαν ἐαν γαρ γαρ ἐγω με ἀποκτεινω ἀποκτεινητε οὐ οὐ ῥαιδιος ῥᾳδιως ἀλλος ἀλλον τοιουτος τοιουτον εὑρισκω εὑρησετε ἀτεχνωςεἰ ἀτεχνωςεἰ και και γελοιος γελοιοτερον εἰπεινπροσκειμενον εἰπεινπροσκειμενον ὁ τῃ πολεω πολει ὑπο ὑπο ὁ του θεαομαι θεου ὡσπερ ὡσπερ ἱππος ἱππῳ μεγας μεγαλῳ μεν μεν και και γενναιος γενναιῳ ὑπο ὑπο μεγεθος μεγεθους δε δε νωθης νωθεστερῳ και και δεω1 δεομενῳ ἐγειρω ἐγειρεσθαι ὑπο ὑπο μυωπος μυωπος τις τινος οἱος οἱον δη δη ἐγω μοι δοκεω δοκει ὁ ὁ θεος θεος ἐμε ἐμε ὁ τῃ πολεω πολει προστιθημι προστεθηκεναι τοιουτον τοιουτον τις τινα ὁς ὁς συ ὑμας ἐγειρω ἐγειρων και και πειθω πειθων και και ὀνειδιζω ὀνειδιζων εἱς ἑνα ἑκαστος ἑκαστον οὐδεν οὐδεν παυω παυομαι την την ἡμερος ἡμεραν ὁλοξ ὁλην πανταχου πανταχου προσκαθιζω προσκαθιζων	plato
ὁπως ὁπως δε δε συ συ τις τινα πειθω πειθοις ἀν ἀν και και σμικρον σμικρον νεω νουν ἐχω ἐχοντα ἀνθρωπος ἀνθρωπων ὡς ὡς οὐ οὐ ὁ του αὐτος αὐτου εἰμι ἐστιν και και δαιμονιον δαιμονια και και θειος θεια ἡγεομαι ἡγεισθαι και και αὐ2 αὐ ὁ του αὐτος αὐτου μητε μητε δαιμων δαιμονας μητε μητε θεους θεους μητε μητε ἡρως ἡρωας οὐδεις οὐδεμια μηχανη μηχανη εἰμι ἐστιν	plato
ἐπειτα κἀπειτα οἰομαι οἰμαι εὑρισκω εὑρισκουσι πολλην πολλην ἀφθονια ἀφθονιαν οἰομαι οἰομενων μεν μεν οἰδα εἰδεναι τις τι ἀνθρωπος ἀνθρωπων οἰδα εἰδοτων δε δε ὀλιγος ὀλιγα ἠ ἠ οὐδεις οὐδεν	plato
ἀνυτος Ἀνυτος μεν μεν δη δη δια δια την την ὁ του υἱος υἱου πονηραν πονηραν παιδεια παιδειαν και και δια δια την την ἑαυτου αὑτου ἀγνωμοσυνη ἀγνωμοσυνην ἐτι ἐτι και και τετελευτηκως τετελευτηκως τυγχανω τυγχανει κακοδοξια κακοδοξιας	xenophon
